{
  "message_id": "01HZ3AVLBCDEFGH9JKMN0PQRST",
  "ttl": 259200,
  "content_type": "application/json",
  "content_class": "regulatory-filing",
  "content_digest": {
    "alg": "SHA-256",
    "hex": "d8bae9a71f8d30c5cf47817ac8299037541d1a46aa1ee2edd476e3b1119ec77e",
    "hash_mode": "raw-sha256"
  },
  "grade_commitment_salt": "64656d6f2d67726164652d73616c7421",
  "sender_addr": "bw:uid:EU-DE-EOID-7K3D9W0Q2M5FW0",
  "recipient_addr": "bw:uid:EU-FR-PSBID-ZYWVTSRQPNM8M4"
}
